026,App-1 Configuration Changes,2025-03-15 14:00,Ben Sullivan/Development Team,"App-1, specifically its user interface functionality","Detailed analysis revealed that the configuration changes led to JavaScript errors within the application's user interface, which were not identified during the initial deployment process.","1. Upon receiving reports of the issue, the development team initiated an immediate review of the recent configuration changes and their impact on App-1's functionality. 2. A decision was made to roll back the application to its previous stable configuration, effectively eliminating the JavaScript errors and restoring full functionality to the user interface. 3. The rollback was successfully implemented, and App-1's services were fully restored by 15:30, with additional monitoring put in place to ensure stability. 4. A post-mortem analysis was conducted to understand the failure points and to implement improved testing and validation procedures for future configuration changes.",Carla Espinosa/Development Team,2025-03-15 15:30,Resolved,"This incident has highlighted the critical importance of conducting thorough and comprehensive testing of all configuration changes in a dedicated test environment before their application to the production environment. It underscored the need for robust rollback strategies to quickly mitigate any unforeseen issues arising from updates or changes. Furthermore, the incident emphasized the value of continuous monitoring and rapid response mechanisms to address and resolve service disruptions, ensuring the highest levels of service availability and reliability for our users."
027,App-2 Configuration Changes,2025-04-18 16:20,Molly Clock/IT Support,"App-2, specifically its user access and external service integration","An in-depth investigation revealed that the configuration update erroneously included an invalid external service endpoint. This misconfiguration led to the breaking of essential functionalities within App-2, directly affecting user access.","1. The IT support team, upon identifying the issue, initiated a comprehensive review of the recent configuration changes to pinpoint the cause of the access restrictions. 2. Corrective actions were swiftly implemented to rectify the invalid endpoint configuration, thereby restoring the intended access and functionality to all affected users. 3. Full functionality was confirmed to have returned to all users by 17:45, following the successful application of the configuration adjustments. 4. Additional measures, including enhanced configuration change validation processes, were introduced to prevent recurrence of similar issues.",Elliot Reid/IT Support Team,2025-04-18 17:45,Resolved,"This incident has underscored the critical importance of implementing a robust validation process for all configuration changes, particularly those affecting user access and external integrations. It highlighted the necessity for rigorous pre-deployment testing in a controlled environment to identify and rectify potential issues before they impact the production environment. Furthermore, the incident emphasized the value of maintaining clear and comprehensive documentation of all system configurations to facilitate quick resolution of any future discrepancies or issues."
028,App-3 Configuration Changes,2025-05-22 14:30,Bob Kelso/Development Team,"App-3, specifically its database connectivity and performance","A detailed review of the configuration changes revealed that the update inadvertently introduced a restrictive firewall rule that blocked a significant portion of incoming traffic to the database, leading to the observed performance issues.","1. Immediate action was taken by the development team to investigate the root cause of the performance degradation following reports from users and alerts from our system monitoring tools. 2. The problematic firewall rule was identified and corrected, with the original database connection settings being restored to ensure optimal performance and accessibility. 3. App-3's performance was closely monitored following the adjustments to confirm that the issue had been fully resolved and that the application was operating at its expected efficiency levels. 4. Full functionality and optimal performance levels were confirmed to have been restored to all users by 16:00.",John Dorian/Development Team,2025-05-22 16:00,Resolved,"This incident has underscored the critical importance of conducting thorough and comprehensive testing of all configuration changes, particularly those affecting security and connectivity, in a controlled staging environment prior to deployment. It highlighted the need for a balanced approach to security enhancements to ensure they do not adversely impact application performance or user experience. Additionally, the incident emphasized the value of rapid diagnostic and response capabilities in identifying and rectifying configuration issues to minimize their impact on service delivery and maintain user trust."
029,App-4 Configuration Changes,2025-06-30 09:00,Turk Turkleton/IT Operations,"App-4, specifically its security protocols and user access controls","An investigation into the incident revealed that the configuration update applied an incompatible version of a critical security dependency, which led to runtime errors and subsequent user access issues.","1. The IT Operations team, upon notification of the issue, acted swiftly to review the recent configuration changes and identify the cause of the lockout. 2. The problematic configuration changes were reversed, and the application was reverted to its previous stable state, effectively restoring access for all affected users. 3. Full access was confirmed to be restored for all users by 10:30, and a comprehensive review of the change management process was initiated to enhance the application's security posture and prevent recurrence of similar incidents.",Carla Espinosa/Security Team,2025-06-30 10:30,Resolved,"This incident has highlighted the critical need for a robust and stringent change management and review process for all configuration changes, especially those affecting security protocols and user access controls. It underscored the importance of implementing immediate rollback procedures to swiftly address access issues and minimize operational disruptions. Additionally, the incident emphasized the value of conducting thorough pre-deployment testing in a controlled environment to detect potential issues before they affect the production environment, ensuring the reliability and integrity of user access at all times."
003,Router-1 Configuration Changes,2023-04-05 14:20,Cynthia Moore/IT Support,"Router-1, indirectly affecting Firewall-1, App-1, and App-2","Incorrect Router-1 configuration update applied, which included invalid routing rules and inadvertently disrupted the traffic flow to Firewall-1, thereby affecting App-1 and App-2.","1. The issue was identified as a misconfiguration during a routine review. 2. Configuration changes were rolled back to the previous stable state at 15:00. 3. Full connectivity for App-1 and App-2 was restored by 15:30, after confirming the correct traffic flow through Firewall-1. 4. Conducted a post-mortem analysis to understand the missteps and implement safeguards.",David Lee/Network Engineering,2023-04-05 15:30,Resolved,"The incident highlighted the need for stricter change management protocols, including pre-approval processes for any configuration changes to critical network components. It underscored the importance of immediate rollback capabilities, comprehensive logging of all changes, and enhanced training for IT staff on the potential impacts of configuration changes. Additionally, the incident emphasized the need for a robust validation process post-configuration change to ensure network stability and service availability."
004,Router-2 is not reachable,2023-05-10 11:47,Ethan Wright/Network Operations,"Router-2, indirectly affecting Firewall-2, App-3, and App-4",Power failure caused Router-2 to shut down unexpectedly. Subsequent hardware diagnostics confirmed a power supply unit (PSU) failure as the specific cause.,"1. Immediate notification to the hardware team for diagnostics. 2. Temporary routing adjustments made to divert traffic through Router-1 while Router-2 was under investigation, ensuring minimal service disruption. 3. Hardware fault identified as a PSU failure, and Router-2 was replaced at 14:30. 4. After replacement, comprehensive testing was conducted to ensure Router-2's full operational capacity. 5. Router-2 was brought back online, and normal service for App-3 and App-4 was restored by 15:00.",Fiona Kelley/Hardware Support Team,2023-05-10 15:00,Resolved,"This incident underlined the importance of having a robust hardware monitoring and failure detection system in place, particularly for critical network components like routers. It also highlighted the need for a quicker hardware replacement process and the effectiveness of having a contingency plan, such as traffic rerouting capabilities, to maintain service continuity during critical hardware failures. Additionally, the incident emphasized the value of regular power supply unit (PSU) checks and replacements as part of routine maintenance to prevent similar outages."
005,Router-2 Configuration Changes,2023-06-15 09:30,Gregory Hines/IT Support,"Router-2, indirectly affecting Firewall-2, App-3, and App-4","An incorrect subnet mask was applied during Router-2's configuration update, leading to routing issues that prevented external access to App-3 and App-4.","1. The issue was detected through automated monitoring alerts and immediate manual checks by the IT Support team. 2. IT Support initiated an emergency protocol to assess and rectify the configuration errors. 3. Configuration changes were rolled back to the last known good configuration at 10:15, following a quick review to confirm the rollback would not introduce other issues. 4. Full service was restored to App-3 and App-4 by 10:45, after thorough testing to ensure connectivity was fully functional. 5. A post-incident review was scheduled to discuss the incident and implement measures to prevent future occurrences.",Hannah Klein/Network Operations Team,2023-06-15 10:45,Resolved,"This incident emphasized the critical need for a more rigorous pre-deployment testing phase for any configuration changes to critical network infrastructure, ensuring that all changes are vetted through a comprehensive review process. It also highlighted the importance of having a quick and effective rollback strategy for immediately addressing any issues that arise post-deployment, minimizing downtime and service disruption. The incident further underlined the value of automated monitoring systems in quickly detecting and alerting on operational anomalies."
006,Firewall-1 is not reachable,2023-07-22 14:05,Isabel Martinez/Security Team,"Firewall-1, indirectly affecting Router-1, App-1, and App-2",Further diagnostics identified the root cause as a software crash due to a memory leak within Firewall-1's operating system.,"1. Immediate escalation to the network operations team for detailed diagnostics. 2. Temporary measures were implemented to reroute critical traffic through an alternative path while the issue was being resolved. 3. The software issue was addressed by applying an emergency patch to fix the memory leak, and the system was closely monitored for stability. 4. Firewall-1 was successfully rebooted, and full functionality was restored by 16:00, after which traffic was rerouted back to its original path.",Jason Clark/Network Operations,2023-07-22 16:00,Resolved,"This incident highlighted the critical need for regular software maintenance and updates for all network security devices to prevent software-related failures. It also emphasized the importance of having a robust monitoring system in place that can quickly detect and alert on such failures, ensuring minimal downtime. The effectiveness of having a contingency plan, including traffic rerouting capabilities, was proven to be invaluable in maintaining service continuity during the outage."
007,Firewall-1 Configuration Changes,2023-08-03 10:20,Natalie Chen/Cybersecurity,"Firewall-1, indirectly affecting Router-1, App-1, and App-2","An incorrect IP address range was included during the Firewall-1 configuration update, leading to the unintended blocking of legitimate traffic.","1. The configuration error was quickly detected through automated monitoring systems, triggering an immediate alert. 2. The Cybersecurity team, in collaboration with Network Operations, initiated an emergency protocol to assess and correct the configuration. 3. Configuration changes were meticulously reviewed and then rolled back to the previous stable version at 11:45, following a thorough verification process to ensure no other issues were present. 4. Full service was restored to App-1 and App-2 by 12:15, after conducting extensive testing to confirm the resolution of the issue. 5. A post-incident review was scheduled to analyze the incident in depth and to develop strategies to prevent similar occurrences in the future.",Oliver Grant/Network Operations Team,2023-08-03 12:15,Resolved,"This incident highlighted the critical need for a more rigorous configuration change process, emphasizing the importance of pre-approval by both cybersecurity and network operations teams. It also demonstrated the value of having immediate rollback capabilities to quickly address any issues post-deployment. Furthermore, the incident reinforced the importance of automated monitoring systems in detecting and alerting on operational anomalies swiftly, ensuring minimal impact on service continuity."
008,Firewall-1 Routing All Traffic to App-1,2023-09-14 08:30,Marco Silva/IT Operations,"Firewall-1, indirectly affecting App-1 and App-2","The root cause was identified as a typo in Firewall-1's configuration, which mistakenly routed all traffic to App-1 instead of distributing it appropriately between App-1 and App-2.","1. The routing misconfiguration was quickly identified by the network team through routine system checks and alerts from the monitoring system. 2. Immediate corrective action was taken to adjust the routing rules, ensuring a balanced distribution of traffic to both App-1 and App-2. 3. The corrected configuration was applied, and normal traffic flow was restored by 09:15, with continuous monitoring to ensure stability. 4. A comprehensive review of firewall configurations was initiated to prevent similar incidents.",Sophia Loren/Network Team,2023-09-14 09:15,Resolved,"This incident underscored the critical importance of validating configuration changes through a staging environment before deployment to production. It also highlighted the need for immediate post-deployment checks to ensure all services are operating as expected. Additionally, the incident reinforced the value of having a robust monitoring system in place that can quickly detect and alert on such misconfigurations, minimizing the impact on service availability and performance."
009,Firewall-1 Routing All Traffic to App-2,2023-10-05 11:00,Liam Wong/IT Security,"Firewall-1, indirectly affecting App-1 and App-2","The root cause was identified as a misconfigured rule in Firewall-1 that incorrectly prioritized all traffic to App-2, disregarding the established routing protocols for App-1.","1. The configuration anomaly was detected through routine monitoring and immediate alerts from the IT security infrastructure. 2. IT Security swiftly initiated a review of the firewall rules and identified the misconfigured settings. 3. Corrective measures were implemented to adjust the firewall rules, ensuring balanced and correct distribution of traffic to both App-1 and App-2. 4. The corrected configuration was applied, and normal traffic flow was restored by 12:30, with continuous monitoring to ensure the issue was fully resolved. 5. A post-incident analysis was conducted to refine the firewall rule update process, incorporating additional checks and balances to prevent recurrence.",Emma Patel/IT Security Team,2023-10-05 12:30,Resolved,"This incident underscored the critical importance of rigorous configuration validation and testing within a controlled environment prior to live deployment. It highlighted the need for detailed review processes for firewall configurations, especially when changes are made, to ensure they align with intended traffic routing protocols. Additionally, the value of rapid detection and response mechanisms was reinforced, demonstrating their effectiveness in minimizing operational disruptions and maintaining service integrity."
