Incident ID,Title,Date and Time,Reported By,Component Affected,Root Cause,Resolution Steps,Resolved By,Resolution Date and Time,Current Status,Lessons Learned
001,Database-1 is not accessible,2023-03-15 08:45,John Doe/IT Department,"Database-1, indirectly affecting Service-1, Service-2, Service-3, Service-4, App-1, App-2, App-3, and App-4",Database-1 became unresponsive due to a deadlock situation caused by conflicting transactions.,1. Identified and terminated the conflicting transactions causing the deadlock. 2. Restarted Database-1 to restore access. 3. Implemented additional monitoring on Database-1 to detect and alert on deadlock situations more rapidly. 4. Reviewed and optimized transaction handling and queries in Service-2 and Service-4 to prevent future deadlocks.,Jane Smith/Database Team,2023-03-15 10:30,Resolved,"Investigation revealed a deadlock situation caused by conflicting transactions as the root cause. Future preventive measures include enhancing monitoring for early deadlock detection, regular audits of transaction handling and query optimization, and establishing a rapid response protocol for database accessibility issues to minimize impact on dependent services and applications."
010,Firewall-2 is not reachable,2023-11-10 09:15,Derek Yu/Network Operations,"Firewall-2, indirectly affecting App-3 and App-4","Initial assessments suggested a hardware failure; however, further investigation revealed Firewall-2 became unresponsive due to an overload of connections, exceeding its handling capacity and leading to a system crash.","1. Immediate escalation to the hardware team for diagnostics revealed the overload issue. 2. System configurations were adjusted to manage connection loads more efficiently, and faulty hardware components contributing to the overload were identified and replaced by 12:00. 3. Firewall-2 functionality was fully restored, and normal operations for App-3 and App-4 resumed by 12:30, following thorough testing to ensure stability. 4. Measures were implemented to enhance monitoring and alerting for unusual traffic patterns to prevent future overloads.",Anna Bell/Hardware Support Team,2023-11-10 12:30,Resolved,This incident highlighted the critical need for regular maintenance checks and the importance of having spare parts readily available for critical infrastructure components. It also underscored the importance of dynamic load management and the need for robust monitoring systems capable of detecting and alerting on potential overload conditions to ensure quick recovery from hardware failures and maintain service continuity.
011,Firewall-2 Configuration Changes,2023-12-05 14:45,Michael Chen/IT Security,"Firewall-2, indirectly affecting App-3 and App-4","An investigation revealed that the configuration update to Firewall-2, which inadvertently blocked necessary ports, was due to unauthorized changes made by an unidentified internal source.","1. The unauthorized changes were detected through routine security monitoring and alerts. 2. Immediate action was taken to review and correct the Firewall-2 configurations, ensuring all necessary ports for App-3 and App-4 were open and accessible by 15:30. 3. Full functionality for App-3 and App-4 was restored, followed by a comprehensive security review to enhance measures preventing unauthorized access and changes. 4. Additional training and awareness programs were scheduled for IT staff to reinforce the importance of secure configuration management and oversight.",Sophie Turner/Network Security Team,2023-12-05 15:30,Resolved,"This incident emphasized the critical importance of stringent access controls, regular configuration audits, and the need for a robust change management process to detect and rectify unauthorized changes promptly. It also highlighted the value of continuous education and training for all IT staff on security best practices and the management of network security devices."
012,Firewall-2 Routing All Traffic to App-3,2024-01-20 11:00,Alexa Ramirez/Network Operations,"Firewall-2, indirectly affecting App-3 and App-4","A configuration error in Firewall-2's routing rules mistakenly directed all incoming traffic to App-3, completely neglecting the designated routes for App-4.","1. The misconfiguration was quickly identified through detailed traffic monitoring and analysis. 2. Immediate corrective action was taken to revise and properly implement the routing rules, ensuring balanced traffic distribution to both App-3 and App-4. 3. Access to App-4 was fully restored by 12:30, and operational stability was confirmed through subsequent monitoring. 4. A comprehensive review of firewall configuration processes was initiated to enhance oversight and prevent similar incidents.",Brian Foster/IT Security,2024-01-20 12:30,Resolved,"This incident highlighted the critical importance of rigorous pre-implementation review and testing of firewall configurations to ensure accurate traffic routing. It also emphasized the need for continuous monitoring and swift response mechanisms to quickly address any misconfigurations, minimizing impact on service availability and maintaining network integrity."
013,Firewall-2 Routing All Traffic to App-4,2024-02-15 09:45,Carla Espinosa/Network Management,"Firewall-2, indirectly affecting App-3 and App-4","The root cause was traced back to an incorrectly configured rule set in Firewall-2, which was intended to manage traffic between App-3 and App-4 but instead isolated App-3 due to a misdirected traffic flow.","1. The anomaly in traffic flow was detected through our network monitoring systems, which triggered an immediate investigation. 2. Network engineers promptly reviewed and identified the misconfiguration within Firewall-2's settings. 3. Corrective actions were taken to adjust the firewall configuration, ensuring a balanced and correct distribution of traffic to both App-3 and App-4. 4. Normal service operations for App-3 were restored by 10:30, and measures were taken to monitor the traffic flow to prevent similar incidents.",Ted Mosby/Network Engineering,2024-02-15 10:30,Resolved,This incident reinforced the critical importance of accurate configuration management for network security devices and the effectiveness of network monitoring systems in identifying and mitigating issues promptly. It also highlighted the need for regular reviews of firewall rules and configurations to ensure they reflect the current network architecture and traffic management requirements accurately.
014,Service-2 is not accessible,2024-03-05 13:20,Jordan Sullivan/IT Support,"Service-2, indirectly affecting App-1 and App-2","An unhandled exception within the codebase of Service-2 led to a server crash, highlighting a critical vulnerability in error handling and resource management.","1. IT support initiated immediate diagnostics to identify the cause of the server failure and assess the impact on connected services. 2. A backup server was promptly deployed, and Service-2's functionality was restored, minimizing the downtime experienced by App-1 and App-2. 3. Post-restoration, a thorough code review was conducted to identify and rectify the unhandled exception, preventing future occurrences. 4. Enhanced server health monitoring tools were implemented to provide early warnings of similar issues.",Keith Dudemeister/IT Operations,2024-03-05 14:50,Resolved,"This incident underlined the necessity for comprehensive server health monitoring and the importance of implementing an efficient and reliable backup strategy. It also highlighted the need for rigorous code testing and review processes to identify potential unhandled exceptions or vulnerabilities that could lead to service disruptions. Additionally, the incident reinforced the value of having a rapid response plan for IT support teams to ensure continuity of service and minimize operational impact."
015,Service-2 Changes,2024-04-12 16:30,Perry Cox/Development Team,"Service-2, indirectly affecting App-1 and App-2",The root cause of the incident was identified as incorrect API endpoint configurations included in the recent update to Service-2. This disrupted the established communication protocols with Service-1.,"1. The issue was promptly identified through routine system checks and alerts from the monitoring tools. 2. The development team initiated an immediate review of the recent changes to Service-2 and identified the misconfiguration. 3. A decision was made to roll back Service-2 to its last stable configuration, which was successfully implemented by 17:15. 4. Full functionality and service connectivity were restored, and additional tests were conducted to ensure system stability. 5. A post-mortem analysis was scheduled to review the incident and implement measures to prevent recurrence.",Elliot Reid/Development Team,2024-04-12 17:15,Resolved,"This incident emphasized the critical importance of conducting thorough testing and validation of all service updates in a staging environment prior to their deployment to the production environment. It highlighted the need for robust change management processes and the benefits of having automated rollback capabilities to quickly revert changes in case of an incident. Additionally, the incident reinforced the value of continuous monitoring and alerting systems in detecting and addressing service disruptions promptly."
016,Service-4 is not accessible,2024-05-18 10:30,Kim Briggs/IT Support,"Service-4, indirectly affecting App-3 and App-4","An exhaustive analysis revealed that Service-4's inaccessibility was due to system resource exhaustion, compounded by a misconfigured network setting that failed to allocate additional resources as needed.","1. Immediate action was taken by IT Support to diagnose the network configuration issue, identifying the exhausted system resources as the primary cause. 2. Network configurations were promptly adjusted to correct the resource allocation issue, and Service-4's system resources were expanded to handle the increased load. 3. Service-4 was successfully restarted and closely monitored to ensure stability and full operational functionality, with service fully restored by 12:00. 4. Post-incident, a comprehensive review of network and resource management configurations was conducted to prevent recurrence.",Chris Turk/Network Engineering,2024-05-18 12:00,Resolved,"The incident underscored the critical importance of ongoing monitoring and proactive management of system resources to ensure service availability. It also highlighted the necessity for regular network configuration audits and the implementation of dynamic resource allocation mechanisms to swiftly respond to changing load demands. Furthermore, the value of a rapid response plan was reaffirmed, emphasizing the need for preparedness in addressing critical service outages effectively."
017,Service-4 Changes,2024-06-22 15:45,Laverne Roberts/Software Development,"Service-4, indirectly affecting App-3 and App-4","An analysis revealed that the configuration changes in Service-4 made during the recent update included incompatible API updates. These changes broke the existing integration with Service-3 and the database, leading to the observed issues.","1. The software development team quickly identified the issue through routine system checks and immediate feedback from affected services. 2. A targeted hotfix was developed to address the specific bug introduced by the Service-4 update. This hotfix was tested rigorously in a controlled environment to ensure it resolved the issue without introducing new problems. 3. The hotfix was deployed to the production environment, successfully rectifying the bug in Service-4 and restoring full functionality to App-3 and App-4 by 17:30. 4. Post-deployment, additional monitoring was implemented to ensure the stability of the service and to quickly identify any further issues arising from the changes.",Carla Espinosa/Software Development,2024-06-22 17:30,Resolved,"This incident underscored the critical importance of conducting comprehensive testing before deploying updates to production environments, ensuring that all system integrations remain functional and compatible. It also highlighted the need for a rapid response mechanism to address unforeseen issues post-deployment, minimizing the impact on service availability and maintaining trust with end-users."
018,Service-1 is not accessible,2024-07-04 08:20,Todd Quinlan/IT Department,"Service-1, indirectly affecting App-1 and App-2","An investigation into the incident revealed that Service-1 was accidentally shut down during routine maintenance activities, leading to an immediate loss of service.","1. The issue was promptly identified by the IT support team, who initiated an immediate investigation into the cause of the server shutdown. 2. Actions were taken to reallocate server resources efficiently and restart Service-1, ensuring it could handle the existing load and prevent similar incidents in the future. 3. Service-1 was successfully brought back online, with full functionality restored by 09:45, and measures were put in place to monitor the service closely for any signs of instability. 4. A review of maintenance protocols was conducted to enhance procedures and prevent accidental shutdowns during routine operations.",Elliot Reid/IT Support Team,2024-07-04 09:45,Resolved,"This incident underscored the critical importance of proactive server load monitoring and the need for scalable solutions to accommodate unexpected spikes in demand. It also highlighted the necessity of implementing strict maintenance protocols to minimize the risk of accidental service disruptions. Furthermore, the value of rapid response and effective communication with stakeholders during service outages was reaffirmed, ensuring transparency and trust are maintained."
019,Service-1 Changes,2024-08-15 14:30,Jordan Sullivan/Development Team,"Service-1, indirectly affecting App-1 and App-2","A detailed analysis identified that the recent update to Service-1 contained a bug affecting data retrieval functions, which was not caught in the initial testing phase.","1. The development team was alerted to the issue through automated alerts and immediate feedback from affected services. 2. A rapid response was initiated, with developers working to diagnose and address the coding error. A fix was developed and tested to ensure it resolved the issue without introducing new problems. 3. The fix was deployed to the production environment, successfully restoring full functionality to Service-1 and consequently to App-1 and App-2 by 16:00. 4. Post-deployment, the system was closely monitored to ensure stability and a comprehensive review was conducted to prevent similar incidents.",Christopher Turk/Software Engineering,2024-08-15 16:00,Resolved,"This incident underscored the critical importance of implementing a rigorous code review and testing process prior to deploying updates, especially for changes affecting critical service components. It highlighted the need for enhanced quality assurance measures, including automated testing and staging environment validations, to identify and rectify potential issues before they impact production services. Additionally, the value of a swift and coordinated response to service disruptions was reaffirmed, emphasizing the need for preparedness and effective communication within the development and operations teams."
002,Router-1 is not reachable,2023-02-20 09:32,Alice Johnson/Network Operations,"Router-1, indirectly affecting Firewall-1, App-1, and App-2","Router-1 firmware issue led to a network interface failure, making the router unresponsive.","1. Network team alerted and began troubleshooting. 2. Identified the firmware issue as the cause of the network interface failure. 3. Applied an emergency firmware update to Router-1 to address the issue. 4. Restarted Router-1 at 10:15 after applying the firmware update. 5. Connectivity restored, and services for App-1 and App-2 resumed normal operation by 10:45.",Bob Smith/Network Operations,2023-02-20 10:45,Resolved,"The incident with Router-1 highlighted the importance of maintaining up-to-date firmware on all network devices to prevent unexpected failures. It has prompted the implementation of a regular review and update schedule for network device firmware. Additionally, the incident underscores the need for a more robust monitoring system that can detect and alert on such failures more quickly, minimizing downtime and ensuring business continuity."
020,Service-3 is not accessible,2024-09-10 11:45,Kelso Zabielski/IT Operations,"Service-3, indirectly affecting App-3 and App-4","An in-depth investigation revealed that the inaccessibility of Service-3 was due to a misconfigured network router, which created a network partition, isolating Service-3 from its intended network segment.","1. The service disruption was quickly detected through our network monitoring systems, prompting an immediate investigation by network administrators. 2. The root cause was identified as a misconfiguration in one of the network routers. Corrective actions were taken to reconfigure the router settings properly, eliminating the network partition and restoring full connectivity to Service-3. 3. Service-3 was closely monitored following the correction to ensure stability and full operational functionality, with service fully restored by 13:30. 4. Additional measures, including a review and update of network configuration management practices, were implemented to prevent similar incidents.",Bob Kelso/Network Administration,2024-09-10 13:30,Resolved,"This incident underscored the critical need for continuous and proactive network configuration audits and the implementation of advanced monitoring tools capable of quickly detecting and alerting on network partitions and other connectivity issues. It also highlighted the importance of having a rapid response mechanism in place to address and resolve network configuration errors efficiently, minimizing the impact on service availability and maintaining a high level of user satisfaction."
021,Service-3 Changes,2024-10-05 09:30,The Janitor/IT Support,"Service-3, indirectly affecting App-3 and App-4","The root cause of the issue was traced back to configuration changes in Service-3 that introduced an incorrect security certificate. This error resulted in SSL/TLS handshake failures, disrupting secure communication channels.","1. The problem was swiftly identified through our automated performance and security monitoring systems, which flagged the abnormal behavior. 2. The development team took immediate action, performing a rollback to the previous stable version of Service-3 to quickly restore its functionality and ensure service continuity for App-3 and App-4. 3. Following the rollback, a thorough review of the changes was conducted to isolate and correct the misconfiguration before attempting to reintroduce the enhancements. 4. Enhanced testing protocols, including additional security certificate validation checks, were implemented to prevent similar issues in future updates.",Elliot Reid/Development Team,2024-10-05 11:00,Resolved,"This incident highlighted the critical importance of conducting comprehensive testing, including security and performance aspects, for any new features or changes in a controlled environment before their deployment to the production environment. It underscored the necessity of having robust rollback mechanisms in place to quickly mitigate issues that may arise from new deployments, ensuring minimal impact on service availability and user experience."
022,App-1 is not accessible,2024-11-15 08:00,Carla Espinosa/IT Department,"App-1, indirectly affecting database connectivity","Detailed diagnostics revealed that the server hosting App-1 had its disk space fully utilized, primarily due to unchecked log file growth, which in turn prevented the application from accessing the database effectively.","1. IT support was immediately notified of the issue and initiated a comprehensive diagnostic to pinpoint the root cause. 2. Actions were taken to clear the unnecessary files and optimize the disk space usage on the server, ensuring that App-1 had sufficient resources to operate. 3. The database connection was successfully restored, and App-1's accessibility was fully reinstated by 10:30, with measures implemented to monitor disk space usage closely to prevent recurrence. 4. A review of log management and server maintenance practices was conducted to enhance system resilience and operational efficiency.",John Dorian/Database Management,2024-11-15 10:30,Resolved,"This incident underscored the critical importance of implementing proactive monitoring and management strategies for server resources, particularly disk space. It highlighted the necessity for regular maintenance routines, including log file management and disk usage reviews, to ensure the high availability of critical applications like App-1. Furthermore, it emphasized the value of having effective alerting mechanisms in place to quickly identify and mitigate potential issues before they escalate into service-impacting problems."
023,App-2 is not accessible,2024-12-20 07:45,Perry Cox/IT Support,"App-2, specifically its backend services and database","Detailed analysis identified that the failure was due to a corrupt database index caused by the latest update, which was not detected during the initial deployment process.","1. Upon detection of the issue, the IT support team immediately alerted the development team, who began an urgent investigation into the cause of the failure. 2. The development team identified the corrupt database index as the root cause and decided to perform a rollback to the application's state before the update to quickly restore service functionality. 3. App-2's services were fully restored, and operational status was achieved by 09:30, following the successful rollback and verification of system integrity and performance. 4. Post-incident, a review of the update and deployment procedures was conducted to strengthen the testing and validation processes, particularly focusing on database integrity and application stability.",Christopher Turk/Development Team,2024-12-20 09:30,Resolved,"This incident has highlighted the critical importance of implementing comprehensive testing and validation processes for all updates, especially those involving significant changes to backend services and database structures. It emphasized the need for a robust rollback strategy to quickly mitigate unforeseen issues post-deployment. Additionally, the incident underscored the value of continuous monitoring and rapid response capabilities to ensure high availability and reliability of critical business applications."
024,App-3 is not accessible,2025-01-10 08:15,Doug Murphy/IT Support,"App-3, directly impacting user access and service delivery","An investigation revealed that an automated script, which was intended to manage resources for another application, inadvertently stopped App-3. This misdirected action was due to a misconfiguration in the script's target parameters.","1. Immediate action was taken by the IT support team upon notification of the issue, with a detailed analysis conducted to identify the root cause. 2. The erroneous script was corrected, and measures were taken to prevent similar misconfigurations in the future. 3. App-3 was promptly restarted, with all services verified to be fully functional and accessible to users by 09:45. 4. Post-resolution, a review of update and deployment procedures was initiated to enhance the robustness of our IT operations and minimize the risk of similar incidents.",Lloyd Slawski/IT Operations,2025-01-10 09:45,Resolved,"This incident has underscored the critical importance of conducting thorough pre-deployment testing for all updates and changes, especially those involving automated scripts and configurations that could impact multiple services. It also highlighted the necessity for having rapid response and recovery protocols in place, ensuring that any access issues can be promptly addressed to maintain service continuity and minimize operational disruptions. Additionally, the incident emphasized the value of clear documentation and strict adherence to change management processes to safeguard against unintended consequences of routine maintenance activities."
025,App-4 is not accessible,2025-02-20 10:30,Ted Buckland/IT Department,"App-4, including its hosting infrastructure","Detailed analysis with the hosting provider revealed that the outage was caused by a hypervisor crash, which led to an unplanned restart of App-4's hosting environment.","1. Immediate contact was established with the hosting provider to report the incident and initiate a diagnostic review of the hosting environment. 2. The hosting provider conducted emergency maintenance, identifying and rectifying the issue with the hypervisor to prevent further occurrences. 3. App-4's services were systematically restored, with full functionality confirmed and verified by 12:00. 4. Post-incident, a review of the disaster recovery and business continuity plans was conducted to enhance resilience against similar incidents.",Janitor/Hosting Provider Support,2025-02-20 12:00,Resolved,"The incident has underscored the critical importance of having a robust disaster recovery plan in place, including regular testing and updates to ensure its effectiveness. It also highlighted the necessity of maintaining open and effective communication channels with all service providers, enabling swift action and resolution in the event of an infrastructure failure. Additionally, the incident emphasized the value of proactive monitoring and redundancy measures within the hosting infrastructure to detect and mitigate potential failures before they impact service availability."
